{
  "schema": "rusty.quest.sidecar.manifold_public_derivative_schema_slice_response_submission_intake_response_expectation.v1",
  "expectation_id": "expectation.manifold_public_derivative_schema_slice_response_submission_intake_response.synthetic.001",
  "generated_at": "2026-06-05T01:28:00Z",
  "expectation_status": "ready_for_manifold_submission_intake_response",
  "source_submission_envelope_expectation": {
    "path": "fixtures/valid/manifold-public-derivative-schema-slice-response-submission-envelope-expectation.synthetic.json",
    "schema": "rusty.quest.sidecar.manifold_public_derivative_schema_slice_response_submission_envelope_expectation.v1",
    "expectation_id": "expectation.manifold_public_derivative_schema_slice_response_submission_envelope.synthetic.001",
    "expectation_status": "ready_for_manifold_submission_envelope",
    "next_gate": "operator_submission_envelope_or_manifold_repo_public_derivative_schema_slice_response"
  },
  "expectation_scope": {
    "expectation_class": "manifold_submission_intake_response_expectation",
    "source_mode": "synthetic_fixture",
    "operator_decision_record_status": "not_created",
    "operator_decision_status": "not_recorded",
    "submission_envelope_status": "not_created",
    "manifold_submission_status": "not_submitted",
    "manifold_repo_touch_status": "not_touched",
    "manifold_intake_response_status": "not_created",
    "manifold_decision_status": "not_created",
    "manifold_accepted_state_status": "not_created",
    "manifold_audit_record_status": "not_created",
    "hostess_route_status": "not_created",
    "hostess_input_status": "not_created",
    "live_evidence_status": "not_included",
    "adb_status": "not_used",
    "command_status": "no_commands"
  },
  "authority": {
    "expectation_owner": "rusty.quest.sidecar_mesh",
    "submission_envelope_owner_after_operator_decision": "operator",
    "submission_request_owner": "operator",
    "intake_response_owner": "rusty.manifold",
    "submission_acceptance_owner": "rusty.manifold",
    "handoff_acceptance_owner": "rusty.manifold",
    "decision_owner": "rusty.manifold",
    "runtime_authority_owner": "rusty.manifold",
    "session_authority_owner": "rusty.manifold",
    "audit_owner": "rusty.manifold.audit",
    "accepted_state_owner": "rusty.manifold",
    "hostess_boundary_descriptor_owner": "rusty.manifold",
    "future_hostess_route_owner": "rusty.hostess",
    "hostess_device_action_authority": "not_in_sidecar",
    "sidecar_role": "observer_proposer",
    "proposal_status": "not_accepted"
  },
  "expected_manifold_intake_response": {
    "response_status": "not_created",
    "response_class": "manifold_owned_submission_intake_response",
    "allowed_response_owner": "rusty.manifold",
    "allowed_decisions": [
      "received_for_review",
      "request_submission_revision",
      "reject_submission_envelope"
    ],
    "required_fields": [
      "response_id",
      "submission_envelope_id",
      "source_handoff_package_id",
      "decision",
      "decision_owner",
      "created_at",
      "reviewed_artifacts",
      "validation_report_ref",
      "audit_record_ref",
      "source_chain_digest_status",
      "redaction_review_status",
      "hostess_boundary_intent",
      "reason"
    ],
    "must_not_contain": [
      "endpoint_values",
      "pairing_material",
      "adb_targets",
      "commands",
      "raw_logs",
      "visual_captures",
      "private_device_ids",
      "hostess_direct_input",
      "sidecar_created_state"
    ],
    "default_without_response": "hold",
    "creates_accepted_state": false,
    "creates_hostess_input": false
  },
  "manifold_acceptance_after_response": {
    "response_status": "not_created",
    "submission_status": "not_submitted",
    "acceptance_status": "not_accepted",
    "accepted_state_status": "not_created",
    "audit_record_status": "not_created",
    "validation_report_status": "not_created",
    "response_owner": "rusty.manifold",
    "acceptance_owner": "rusty.manifold",
    "accepted_state_owner": "rusty.manifold",
    "audit_owner": "rusty.manifold.audit",
    "requires_operator_submission_envelope": true,
    "requires_redaction_review": true,
    "requires_source_chain_digest": true,
    "sidecar_can_create_response": false,
    "sidecar_can_accept": false,
    "sidecar_can_create_state": false,
    "sidecar_can_create_audit": false
  },
  "hostess_boundary_after_response": {
    "status": "future_lane_not_requested",
    "route_status": "not_created",
    "input_status": "not_created",
    "device_action_authority": "not_in_sidecar",
    "future_route_owner": "rusty.hostess",
    "boundary_descriptor_owner": "rusty.manifold",
    "consumes_only": "manifold_accepted_state_or_explicit_operator_request_descriptor",
    "sidecar_direct_input_allowed": false,
    "requires_manifold_accepted_state": true,
    "requires_explicit_operator_request": true,
    "gate_result": "intake_response_expectation_without_hostess_input"
  },
  "validation_evidence": {
    "local_validation_status": "expected_pass",
    "required_commands": [
      "python tools/prepare_manifold_public_derivative_schema_slice_response_submission_intake_response_expectation.py --envelope-expectation fixtures/valid/manifold-public-derivative-schema-slice-response-submission-envelope-expectation.synthetic.json --now 2026-06-05T01:28:00Z --output fixtures/valid/manifold-public-derivative-schema-slice-response-submission-intake-response-expectation.synthetic.json",
      "python tools/evaluate_integration_acceptance.py --repo-root . --now 2026-06-04T21:46:00Z --output fixtures/valid/integration-acceptance-scorecard.synthetic.json",
      "python tools/validate_repo.py --repo-root .",
      "python -m unittest discover -s tests -p test_*.py",
      "git diff --check"
    ],
    "damaged_fixture_policy": "must_fail_validation",
    "future_manifold_gate": "manifold_repo_owned_submission_intake_response",
    "future_hostess_gate": "hostess_route_requires_manifold_state_or_explicit_operator_request_descriptor"
  },
  "privacy_boundary": {
    "contains_endpoint_values": false,
    "contains_pairing_material": false,
    "contains_commands": false,
    "contains_raw_logs": false,
    "contains_visual_captures": false,
    "contains_private_device_ids": false,
    "public_fixture_policy": "synthetic_descriptor_only"
  },
  "checks": [
    {
      "check_id": "submission_intake_response_expectation.source_envelope_expectation_ready",
      "status": "pass",
      "observed": {
        "schema": "rusty.quest.sidecar.manifold_public_derivative_schema_slice_response_submission_envelope_expectation.v1",
        "expectation_status": "ready_for_manifold_submission_envelope",
        "next_gate": "operator_submission_envelope_or_manifold_repo_public_derivative_schema_slice_response"
      },
      "expected": {
        "schema": "rusty.quest.sidecar.manifold_public_derivative_schema_slice_response_submission_envelope_expectation.v1",
        "expectation_status": "ready_for_manifold_submission_envelope",
        "next_gate": "operator_submission_envelope_or_manifold_repo_public_derivative_schema_slice_response"
      },
      "evidence": "fixtures/valid/manifold-public-derivative-schema-slice-response-submission-envelope-expectation.synthetic.json"
    },
    {
      "check_id": "submission_intake_response_expectation.no_submission_response_state_or_hostess_input",
      "status": "pass",
      "observed": {
        "expectation_class": "manifold_submission_intake_response_expectation",
        "source_mode": "synthetic_fixture",
        "operator_decision_record_status": "not_created",
        "operator_decision_status": "not_recorded",
        "submission_envelope_status": "not_created",
        "manifold_submission_status": "not_submitted",
        "manifold_repo_touch_status": "not_touched",
        "manifold_intake_response_status": "not_created",
        "manifold_decision_status": "not_created",
        "manifold_accepted_state_status": "not_created",
        "manifold_audit_record_status": "not_created",
        "hostess_route_status": "not_created",
        "hostess_input_status": "not_created",
        "live_evidence_status": "not_included",
        "adb_status": "not_used",
        "command_status": "no_commands"
      },
      "expected": {
        "operator_decision_record_status": "not_created",
        "operator_decision_status": "not_recorded",
        "submission_envelope_status": "not_created",
        "manifold_submission_status": "not_submitted",
        "manifold_repo_touch_status": "not_touched",
        "manifold_intake_response_status": "not_created",
        "manifold_decision_status": "not_created",
        "manifold_accepted_state_status": "not_created",
        "manifold_audit_record_status": "not_created",
        "hostess_route_status": "not_created",
        "hostess_input_status": "not_created",
        "adb_status": "not_used",
        "command_status": "no_commands"
      },
      "evidence": "expectation creates no submission envelope, Manifold response/state/audit, Hostess input, ADB, or command action"
    },
    {
      "check_id": "submission_intake_response_expectation.authority",
      "status": "pass",
      "observed": {
        "expectation_owner": "rusty.quest.sidecar_mesh",
        "submission_envelope_owner_after_operator_decision": "operator",
        "submission_request_owner": "operator",
        "intake_response_owner": "rusty.manifold",
        "submission_acceptance_owner": "rusty.manifold",
        "handoff_acceptance_owner": "rusty.manifold",
        "decision_owner": "rusty.manifold",
        "runtime_authority_owner": "rusty.manifold",
        "session_authority_owner": "rusty.manifold",
        "audit_owner": "rusty.manifold.audit",
        "accepted_state_owner": "rusty.manifold",
        "hostess_boundary_descriptor_owner": "rusty.manifold",
        "future_hostess_route_owner": "rusty.hostess",